{"run_id":"2026-07-22T09:00:00-04:00-market-community-analyst","agent":"market-community-analyst","started_at":"2026-07-22T09:00:00-04:00","completed_at":"2026-07-22T09:02:00-04:00","execution_status":"success","change_status":"no-change","report_produced":false,"notification_sent":false,"report_id":null,"error_message":null,"sources_checked":12}
